paragraph_id,content
Kebab-In_Norway,"<font color=""blue"">Question</font>: Who introduced the kebob in Norway during the 1980's?<br/><font color=""blue"">Sentence(s)</font>: In Norway, the kebab was introduced by Pakistani and Turkish immigrants during the 1980s."
Ramen-Soup,"<font color=""blue"">Question</font>: What kind of flavor does miso ramen broth have?<br/><font color=""blue"">Sentence(s)</font>: Miso ramen broth tends to have a robust, tangy flavor, so it stands up to a variety of flavorful toppings: spicy bean paste or ""tōbanjan"" (豆瓣醤), butter and corn, leeks, onions, bean sprouts, ground pork, cabbage, sesame seeds, white pepper, and chopped garlic are common."
Udon-Regional_varieties,"<font color=""blue"">Question</font>: What is the broth?<br/><font color=""blue"">Sentence(s)</font>: The broth is soy sauce–based like Japanese udon."
Rice-Nutrients_and_the_nutritional_importance_of_rice,"<font color=""blue"">Question</font>: Consumption of which types of rice reduce the progression of atherosclerotic plaque development?<br/><font color=""blue"">Sentence(s)</font>: Red or black rice consumption was found to reduce or retard the progression of atherosclerotic plaque development, induced by dietary cholesterol, in mammals."
Steak-Skirt_steak,"<font color=""blue"">Question</font>: From what part of a cow is a skirt steak cut?<br/><font color=""blue"">Sentence(s)</font>: A skirt steak is a part of the plate (situated at the cow's abdomen), the steak is long, thick and tender and it is usually priced by its flavour rather than the tenderness because its flavour is better than its tenderness."
Salad-Bound_salad,"<font color=""blue"">Question</font>: What are Bound salads assembled with?<br/><font color=""blue"">Sentence(s)</font>: They are assembled with thick sauces such as mayonnaise."
Popcorn-Abstract,"<font color=""blue"">Question</font>: What's another way in which popcorn is referred to as?<br/><font color=""blue"">Sentence(s)</font>: Popcorn, also known as popping corn, is a type of corn (maize, ""Zea mays var."
Cake-Special-purpose_cakes,"<font color=""blue"">Question</font>: What is ""confarreatio""?<br/><font color=""blue"">Sentence(s)</font>: The Ancient Roman marriage ritual of ""confarreatio"" originated in the sharing of a cake.Particular types of cake may be associated with particular festivals, such as stollen or chocolate log (at Christmas), babka and simnel cake (at Easter), or mooncake."
Ice_cream-Production,"<font color=""blue"">Question</font>: What year did Frederic Tudor build his first ice cream factory?<br/><font color=""blue"">Sentence(s)</font>: He built his first ice cream factory in Seven Valleys, Pennsylvania, in 1851."
Yogurt-Strained_yogurt,"<font color=""blue"">Question</font>: what is strained yogurt strained through?<br/><font color=""blue"">Sentence(s)</font>: Strained yogurt is yogurt which has been strained through a paper or cloth filter, traditionally made of muslin., to remove the whey, giving a much thicker consistency and a distinctive, slightly tangy taste."
Cheese-World_production_and_consumption,"<font color=""blue"">Question</font>: What is the most common cheese in Iceland?<br/><font color=""blue"">Sentence(s)</font>: In Iceland, skyr is the most common cheese."
Coffee-Roasting,"<font color=""blue"">Question</font>: What state is Coffee sold in?<br/><font color=""blue"">Sentence(s)</font>: Coffee is usually sold in a roasted state, and with rare exceptions all coffee is roasted before it is consumed."
Juice-Preparation,"<font color=""blue"">Question</font>: What meal are juices most often enjoyed with?<br/><font color=""blue"">Sentence(s)</font>: Juice is one of the most popular drinks to go with breakfast in the morning.Many commercial juices are filtered to remove fiber or pulp, but high-pulp fresh orange juice is a popular beverage."