paragraph_id,content
Fencing-Other_variants,"<font color=""blue"">Question</font>: What is similar to wheelchair fencing but for the able bodied?<br/><font color=""blue"">Sentence(s)</font>: Chair fencing is similar to wheelchair fencing but for the able bodied."
Archery-Mounted_archery,"<font color=""blue"">Question</font>: What type of bow is more useful when on horseback?<br/><font color=""blue"">Sentence(s)</font>: Shorter bows are more suited to use on horseback, and the composite bow enabled mounted archers to use powerful weapons."
Wrestling-Lucha_libre,"<font color=""blue"">Question</font>: What is another name for Mexican professional wrestling?<br/><font color=""blue"">Sentence(s)</font>: Mexican professional wrestling, also known as ""Lucha libre"" is a style of wrestling that combines mixed-martial arts and the wrestling of North America."
Boxing-Counter_puncher,"<font color=""blue"">Question</font>: What is an advantage of counter hitting?<br/><font color=""blue"">Sentence(s)</font>: A large advantage in counter-hitting is the forward momentum of the attacker, which drives them further into your return strike."
Marathon-Modern_Olympics_marathon,"<font color=""blue"">Question</font>: When did the modern Olympics began?<br/><font color=""blue"">Sentence(s)</font>: When the modern Olympics began in 1896, the initiators and organizers were looking for a great popularizing event, recalling the ancient glory of Greece."
Taekwondo-Abstract,"<font color=""blue"">Question</font>: How many main styles of taekwondo are there?<br/><font color=""blue"">Sentence(s)</font>: Sport taekwondo is in turn subdivided into two main styles."
Judo-Organizations,"<font color=""blue"">Question</font>: When was the International Judo Federation(IJF) Founded?<br/><font color=""blue"">Sentence(s)</font>: The international governing body for judo is the International Judo Federation (IJF), founded in 1951."
Table_tennis-Corkspin,"<font color=""blue"">Question</font>: To impart a spin on the ball which is parallel to its trajectory, how must the racket be swung?<br/><font color=""blue"">Sentence(s)</font>: To impart a spin on the ball which is parallel to its trajectory, the racket must be swung more or less perpendicular to the trajectory of the ball."
United_States-Foreign_relations,"<font color=""blue"">Question</font>: Where do most countries have embassies in the US?<br/><font color=""blue"">Sentence(s)</font>: Almost all countries have embassies in Washington, D.C., and many have consulates around the country."
China-Internationalization_of_the_renminbi,"<font color=""blue"">Question</font>: What year did Russia begin using Chinese renminbi in it's trade?<br/><font color=""blue"">Sentence(s)</font>: In November 2010, Russia began using the Chinese renminbi in its bilateral trade with China."
Russia-Energy,"<font color=""blue"">Question</font>: how many rubles does the Russian government plan to allocate to develop the next generation of nuclear energy technology?<br/><font color=""blue"">Sentence(s)</font>: The Russian government plans to allocate 127 billion rubles ($5.42 billion) to a federal program dedicated to the next generation of nuclear energy technology."
England-Law,"<font color=""blue"">Question</font>: What is the highest court for criminal and civil cases in England and Wales?<br/><font color=""blue"">Sentence(s)</font>: The Supreme Court of the United Kingdom is the highest court for criminal and civil cases in England and Wales."
France-Administrative_divisions,"<font color=""blue"">Question</font>: How many administrative regions is France divided into?<br/><font color=""blue"">Sentence(s)</font>: France is divided into 27 administrative regions, 22 in metropolitan France (including the territorial collectivity of Corsica), and five located overseas."
South_Korea-Religion,"<font color=""blue"">Question</font>: Freedom of religion is guaranteed by what?<br/><font color=""blue"">Sentence(s)</font>: Today, freedom of religion is guaranteed by the constitution, and there is no state religion.Christianity is South Korea's largest religion, accounting for more than half of all South Korean religious adherents."
Japan-Culture,"<font color=""blue"">Question</font>: How many Japanese sites have been inscribed on the UNESCO World Heritage List?<br/><font color=""blue"">Sentence(s)</font>: Sixteen sites have been inscribed on the UNESCO World Heritage List, twelve of which are of cultural significance."
India-Culture,"<font color=""blue"">Question</font>: In what time period were the foundations of Hindu literature laid?<br/><font color=""blue"">Sentence(s)</font>: During the Vedic period (c. 1700 – 500 BCE), the foundations of Hindu philosophy, mythology, and literature were laid, and many beliefs and practices which still exist today, such as ""dhárma"", ""kárma"", ""yóga"", and ""mokṣa"", were established."
Indonesia-Geography,"<font color=""blue"">Question</font>: How many active volcanoes does Indonesia have?<br/><font color=""blue"">Sentence(s)</font>: Indonesia has at least 150 active volcanoes, including Krakatoa and Tambora, both famous for their devastating eruptions in the 19th century."
Brazil-Abstract,"<font color=""blue"">Question</font>: What is Brazil's official name?<br/><font color=""blue"">Sentence(s)</font>: Brazil (, ), officially the Federative Republic of Brazil (, ), is the largest country in both South America and the Latin American region."
Pakistan-Kashmir_conflict,"<font color=""blue"">Question</font>: On what legal grounds does India claim the region of Kashmir?<br/><font color=""blue"">Sentence(s)</font>: India claims Kashmir on the basis of the Instrument of Accession, a legal agreement with Kashmir's leaders executed by Maharaja Hari Singh, then ruler of Kashmir, agreeing to accede the area to India."
Nigeria-Ethno-linguistic_groups,"<font color=""blue"">Question</font>: Where do most minorities in Nigeria reside?<br/><font color=""blue"">Sentence(s)</font>: These minorities mostly reside in major cities such as Lagos and Abuja, or in the Niger Delta as employees for the major oil companies."
Mexico-Science_and_technology,"<font color=""blue"">Question</font>: What year was the National Autonomous University of Mexico established<br/><font color=""blue"">Sentence(s)</font>: The National Autonomous University of Mexico was officially established in 1910, and the university become one of the most important institutes of higher learning in Mexico."
Vietnam-1976–present:_reunification_and_reforms,"<font color=""blue"">Question</font>: How many South Vietnamese were executed in killings?<br/><font color=""blue"">Sentence(s)</font>: Between 100,000 and 200,000 South Vietnamese were executed in extrajudicial killings; another 50,000 died performing hard labor in ""New Economic Zones""."
Egypt-Abstract,"<font color=""blue"">Question</font>: What is a major component of Egypt's economy?<br/><font color=""blue"">Sentence(s)</font>: Egypt's rich cultural legacy, as well as the attraction of its Red Sea Riviera, have made tourism a vital part of the economy, employing about 12 percent of the country's workforce.The economy of Egypt is one of the most diversified in the Middle East, with sectors such as tourism, agriculture, industry and services at almost equal production levels."
Turkey-Geography,"<font color=""blue"">Question</font>: The fault lines that led to the creation of the Black Sea contributed to the creation of what other geologic features of Turkey?<br/><font color=""blue"">Sentence(s)</font>: The Bosphorus and the Dardanelles owe their existence to the fault lines running through Turkey that led to the creation of the Black Sea."
Germany-Health,"<font color=""blue"">Question</font>: In 2005, how did Germany spend of its GDP on health care?<br/><font color=""blue"">Sentence(s)</font>: In 2005, Germany spent 11% of its GDP on health care."
Thailand-28_June_1932,"<font color=""blue"">Question</font>: What does Khana Ratsadon mean in English?<br/><font color=""blue"">Sentence(s)</font>: However on 24 June 1932 a group of civilians and military officers, calling themselves the Khana Ratsadon (or People's Party) carried out a bloodless revolution, in which the 150 years of absolute rule of the House of Chakri was ended."
Italy-Architecture,"<font color=""blue"">Question</font>: What are some examples of fine works of Western architecture that can be found in Italy?<br/><font color=""blue"">Sentence(s)</font>: Several of the finest works in Western architecture, such as the Colosseum, the Milan Cathedral and Florence cathedral, the Leaning Tower of Pisa and the building designs of Venice are found in Italy.Italian architecture has also widely influenced the architecture of the world."
Canada-Abstract,"<font color=""blue"">Question</font>: On what date did three British colonies joined to form the federal dominion of Canada?<br/><font color=""blue"">Sentence(s)</font>: On July 1, 1867, three British colonies joined to form the federal dominion of Canada."
Spain-Music_and_dance,"<font color=""blue"">Question</font>: How man professional orchestras does Spain have?<br/><font color=""blue"">Sentence(s)</font>: In Spain there are over forty professional orchestras, including the Orquestra Simfònica de Barcelona, Orquesta Nacional de España and the Orquesta Sinfónica de Madrid."
The_Lord_of_the_Rings-Publication_history,"<font color=""blue"">Question</font>: Why didn't Tolkien like the title ""The Return of the King""<br/><font color=""blue"">Sentence(s)</font>: Tolkien, moreover, did not especially like the title ""The Return of the King"", believing it gave away too much of the storyline."
The_Terminator-Release,"<font color=""blue"">Question</font>: What did Orion pictures fear about 'The Terminator?'<br/><font color=""blue"">Sentence(s)</font>: Orion Pictures did not have faith in ""The Terminator"" performing well at the box office and feared a negative critical reception."
Terminator_Salvation-Release,"<font color=""blue"">Question</font>: What year was Terminator Salvation released?<br/><font color=""blue"">Sentence(s)</font>: The film was released in North America on May 21, 2009 with Warner Bros. setting the American premiere on May 14, 2009 at the Grauman's Chinese Theatre in Hollywood."
Shrek-Influence,"<font color=""blue"">Question</font>: What film noticeably influenced the current generation of mainstream animated films?<br/><font color=""blue"">Sentence(s)</font>: However, ""Shrek"" itself has noticeably influenced the current generation of mainstream animated films."
Toy_Story-Soundtrack,"<font color=""blue"">Question</font>: Who wrote the soundtrack for the original Toy Story movie?<br/><font color=""blue"">Sentence(s)</font>: Scored and written by Randy Newman, the soundtrack has received praise for its ""sprightly, stirring score""."
Kung_Fu_Panda-Television_series,"<font color=""blue"">Question</font>: On what network does Kung Fu Panda: Legends of Awesomeness air?<br/><font color=""blue"">Sentence(s)</font>: From the cast of ""Kung Fu Panda"", only Lucy Liu and James Hong are reprising their roles of Master Viper and Mr. Ping."
The_Shawshank_Redemption-Music,"<font color=""blue"">Question</font>: Who composed the score of The Shawshank Redemption?<br/><font color=""blue"">Sentence(s)</font>: The score was composed by Thomas Newman and was nominated for an Academy Award for Best Original Score in 1994, which was his first Oscar nomination."
The_Godfather-Current_rankings,"<font color=""blue"">Question</font>: What film beat out ""The Godfather"" in ""Time Out""'s 2003 reader's poll?<br/><font color=""blue"">Sentence(s)</font>:  In ""Time Out""'s 2003 readers' poll, ""The Godfather"" was ranked the second best film of all time, after ""Some Like It Hot""."
Fight_Club-Marketing,"<font color=""blue"">Question</font>: Why did Fincher protest the placement of ""Fight Club"" ads during World Wrestling Federation broadcasts?<br/><font color=""blue"">Sentence(s)</font>: The studio advertised ""Fight Club"" on cable during World Wrestling Federation broadcasts, which Fincher protested, believing that the placement created the wrong context for the film."
Forrest_Gump-Soundtrack,"<font color=""blue"">Question</font>: What year was the score for the film released?<br/><font color=""blue"">Sentence(s)</font>: The score for the film was composed and conducted by Alan Silvestri and released on August 2, 1994."
The_Matrix-Production_design,"<font color=""blue"">Question</font>: What 1995 Japanese cyberpunk film had a strong influence on The Matrix?<br/><font color=""blue"">Sentence(s)</font>: The portrayal resembles the opening credits of the 1995 Japanese cyberpunk film, ""Ghost in the Shell"", which had a strong influence on the ""Matrix"" series (see below)."
The_Usual_Suspects-Nominations_and_awards,"<font color=""blue"">Question</font>: Which Academy Award did Kevin Spacey win for his work on The Usual Suspects?<br/><font color=""blue"">Sentence(s)</font>: Christopher McQuarrie was nominated for the Best Original Screenplay and Kevin Spacey was nominated for Best Supporting Actor at the Academy Awards.</br>They both won, and in his acceptance speech Spacey memorably said, ""Well, whoever Keyser Söze is, I can tell you he's gonna get gloriously drunk tonight."
Life_Is_Beautiful-Awards,"<font color=""blue"">Question</font>: What did 'Life is Beautiful' win in 1998?<br/><font color=""blue"">Sentence(s)</font>: ""Life is Beautiful"" was shown at the 1998 Cannes Film Festival, and went on to win the Grand Prix."
The_Lion_King-Box_office,"<font color=""blue"">Question</font>: What is the highest-grossing motion picture worldwide of 1994?<br/><font color=""blue"">Sentence(s)</font>: It is also the highest-grossing motion picture of 1994 worldwide."
The_Dark_Knight_Rises-Production_design,"<font color=""blue"">Question</font>: Where were the exteriors above the prison filmed?<br/><font color=""blue"">Sentence(s)</font>: Exteriors above the prison were filmed in Jodhpur, India, chosen because the ""forbidding landscape added to the desolation""."
Das_Boot-Soundtrack,"<font color=""blue"">Question</font>: Which song on the official soundtrack for Das Boot was not composed by Doldinger?<br/><font color=""blue"">Sentence(s)</font>: The title theme ""Das Boot"" later became an international hit.The official soundtrack features only compositions by Doldinger, except for ""J'attendrai"" sung by Rina Ketty."
Amélie-Home_media,"<font color=""blue"">Question</font>: When was the first release of the movie ""Amélie""?<br/><font color=""blue"">Sentence(s)</font>: The first release occurred in Canada in September 2008 by TVA Films."
Toy_Story_3-Music,"<font color=""blue"">Question</font>: Who composed and conducted the film score for ""Toy Story 3?""<br/><font color=""blue"">Sentence(s)</font>: The film score for ""Toy Story 3"" was composed and conducted by Randy Newman, his sixth for Pixar after ""Toy Story"", ""A Bug's Life"", ""Toy Story 2"", ""Monsters, Inc."", and ""Cars""."
Despicable_Me-Video_games,"<font color=""blue"">Question</font>: Who was the game developer for Despicable Me: Minion Mania?<br/><font color=""blue"">Sentence(s)</font>: Namco also released a version for the iPhone and iPad platform entitled ""Despicable Me: Minion Mania"", developed by Anino Games.An application for iOSs and Androids was also released under the name ""Despicable Me: Minion Rush""."
Batman_Begins-Abstract,"<font color=""blue"">Question</font>: How much money did Batman Begins amount on it's opening weekend?<br/><font color=""blue"">Sentence(s)</font>: It grossed $48 million in its opening weekend in North America, eventually grossing over $372 million worldwide."
World_War_I-Russian_Revolution,"<font color=""blue"">Question</font>: When was the Brusilov Offensive in eastern Galicia?<br/><font color=""blue"">Sentence(s)</font>: Despite the success of the June 1916 Brusilov Offensive in eastern Galicia, dissatisfaction with the Russian government's conduct of the war grew."
World_War_II-Home_fronts_and_production,"<font color=""blue"">Question</font>: In 1938, at the outbreak of World War II, which had a larger population, the Western Allies (United Kingdom, France, Poland and British Dominions) or the European Axis (Germany and Italy)<br/><font color=""blue"">Sentence(s)</font>: In 1938, the Western Allies (United Kingdom, France, Poland and British Dominions) had a 30 percent larger population and a 30 percent higher gross domestic product than the European Axis (Germany and Italy); if colonies are included, it then gives the Allies more than a 5:1 advantage in population and nearly 2:1 advantage in GDP."
Assassination_of_Abraham_Lincoln-Mudd's_culpability,"<font color=""blue"">Question</font>: Who testified that Booth sent supplies to Mudd's house?<br/><font color=""blue"">Sentence(s)</font>: Additionally, George Atzerodt testified that Booth sent supplies to Mudd's house in preparation for the kidnap plan."
Louisiana_Purchase-Boundaries,"<font color=""blue"">Question</font>: When did Congress pass the Mobile Act which recognized West Florida as being part of the United States?<br/><font color=""blue"">Sentence(s)</font>: In early 1804, Congress passed the Mobile Act which recognized West Florida as being part of the United States."
Manhattan_Project-Soviet_spies,"<font color=""blue"">Question</font>: Who was the head of the Counter Intelligence Branch of the Western Defense Command?<br/><font color=""blue"">Sentence(s)</font>: Lieutenant Colonel Boris T. Pash, the head of the Counter Intelligence Branch of the Western Defense Command, investigated suspected Soviet espionage at the Radiation Laboratory in Berkeley."
Vietnam_War-Casualties,"<font color=""blue"">Question</font>: How many Vietnamese civilians died in the Vietnam War?<br/><font color=""blue"">Sentence(s)</font>: 50,000–65,000 North Vietnamese civilians died in the war."
Apollo_11-Support_crew,"<font color=""blue"">Question</font>: Name a member of the Apollo 11 support crew?<br/><font color=""blue"">Sentence(s)</font>: Charlie Duke, Capsule Communicator (CAPCOM)</br>Ronald Evans (CAPCOM)</br>Owen K. Garriott (CAPCOM)</br>Don L. Lind (CAPCOM)</br>Ken Mattingly (CAPCOM)</br>Bruce McCandless II (CAPCOM)</br>Harrison Schmitt (CAPCOM)</br>Bill Pogue</br>Jack Swigert"
American_Revolution-Role_of_women,"<font color=""blue"">Question</font>: What year did  the women of Boston produce 40,000 skeins of yarn, and 180 women in Middletown, Massachusetts wove of cloth?<br/><font color=""blue"">Sentence(s)</font>: In 1769, the women of Boston produced 40,000 skeins of yarn, and 180 women in Middletown, Massachusetts wove of cloth.A crisis of political loyalties could disrupt the fabric of colonial America women's social worlds: whether a man did or did not renounce his allegiance to the King could dissolve ties of class, family, and friendship, isolating women from former connections."
Protestant_Reformation-Conclusion_and_legacy,"<font color=""blue"">Question</font>: When was the Peace of Augsburg recognized?<br/><font color=""blue"">Sentence(s)</font>:  All parties would now recognise the Peace of Augsburg of 1555, by which each prince would have the right to determine the religion of his own state, the options being Roman Catholicism, Lutheranism, and now Calvinism (the principle of ""cuius regio, eius religio"")"
Boston_Tea_Party-Tea_trade_to_1767,"<font color=""blue"">Question</font>: Where was the biggest market for illicit tea?<br/><font color=""blue"">Sentence(s)</font>: The biggest market for illicit tea was England—by the 1760s the East India Company was losing £400,000 per year to smugglers in Great Britain—but Dutch tea was also smuggled into British America in significant quantities.In 1767, to help the East India Company compete with smuggled Dutch tea, Parliament passed the Indemnity Act, which lowered the tax on tea consumed in Great Britain, and gave the East India Company a refund of the 25% duty on tea that was re-exported to the colonies."
Industrial_Revolution-Population_increase,"<font color=""blue"">Question</font>: What were the causes of Brtain's population doubling every 50 years?<br/><font color=""blue"">Sentence(s)</font>: As living conditions and health care improved during the 19th century, Britain's population doubled every 50 years."
Great_Depression-Inequality,"<font color=""blue"">Question</font>: What, according to the economists, caused the Great Depression?<br/><font color=""blue"">Sentence(s)</font>: Thus the unequal distribution of wealth throughout the 1920s caused the Great Depression.According to this view, the root cause of the Great Depression was a global over-investment in heavy industry capacity compared to wages and earnings from independent businesses, such as farms."
Cold_War-Historiography_and_memory,"<font color=""blue"">Question</font>: In what year was ""Social History"" published?<br/><font color=""blue"">Sentence(s)</font>: ""Revisiting the cultural Cold War,"" ""Social History,"" Aug 2010, Vol."
The_Holocaust-Involvement_of_other_countries_and_nationals,"<font color=""blue"">Question</font>: What conferences took place regarding the Holocaust?<br/><font color=""blue"">Sentence(s)</font>:  Bermuda Conference</br> Évian Conference"
Treaty_of_Versailles-Negotiations,"<font color=""blue"">Question</font>: Were Germany, Austra, and Hungary included in the negotiations?<br/><font color=""blue"">Sentence(s)</font>: Having been defeated, Germany, Austria, and Hungary were excluded from the negotiations."
Chernobyl_disaster-The_United_Nations_Development_Programme,"<font color=""blue"">Question</font>: When was the Chernobyl Recovery and Development Programme launched?<br/><font color=""blue"">Sentence(s)</font>: The United Nations Development Programme has launched in 2003 a specific project called the Chernobyl Recovery and Development Programme (CRDP) for the recovery of the affected areas."
Korean_War-Division_of_Korea_(1954–present),"<font color=""blue"">Question</font>: When did North Korea declare it 'is not restrained by the North-South declaration on non-aggression.'?<br/><font color=""blue"">Sentence(s)</font>: On 13 March 2013, North Korea confirmed it ended the 1953 Armistice and declared North Korea ""is not restrained by the North-South declaration on non-aggression."""
Space_Race-Soviet_Moon_program,"<font color=""blue"">Question</font>: How many people were on board the ""Lunniy Orbitalny Korabl""?<br/><font color=""blue"">Sentence(s)</font>: The orbital module (Soyuz 7K-L3), the """"Lunniy Orbitalny Korabl"""" (LOK), had a crew of two."
DNA-Nucleobase_classification,"<font color=""blue"">Question</font>: What is the first step in the biosynthesis of J?<br/><font color=""blue"">Sentence(s)</font>: Another phage - Staphylococcal phage S6 - has been identified with a genome where thymine has been replaced by uracil.Base J (beta-d-glucopyranosyloxymethyluracil), a modified form of uracil, is also found in a number of organisms: the flagellates ""Diplonema"" and ""Euglena"", and all the kinetoplastid genera Biosynthesis of J occurs in two steps: in the first step a specific thymidine in DNA is converted into hydroxymethyldeoxyuridine; in the second HOMedU is glycosylated to form J. Proteins that bind specifically to this base have been identified."
Climate_change-Precipitation,"<font color=""blue"">Question</font>: When did Last Glacial Maximum happen?<br/><font color=""blue"">Sentence(s)</font>: For instance, during the Last Glacial Maximum of 18,000 years ago, thermal-driven evaporation from the oceans onto continental landmasses was low, causing large areas of extreme desert, including polar deserts (cold but with low rates of precipitation)."
Stem_cell-Properties,"<font color=""blue"">Question</font>: What term describes the ability of a cell to go through numerous cycles of cell division while maintaining the undifferentiated state?<br/><font color=""blue"">Sentence(s)</font>: ""Self-renewal"": the ability to go through numerous cycles of cell division while maintaining the undifferentiated state."
Cloning-Horticultural,"<font color=""blue"">Question</font>: What does the term clone mean?<br/><font color=""blue"">Sentence(s)</font>: The term ""clone"" is used in horticulture to refer to descendants of a single plant which were produced by vegetative reproduction or apomixis."
Global_warming-Initial_causes_of_temperature_changes_(external_forcings),"<font color=""blue"">Question</font>: What are examples of external forcings?<br/><font color=""blue"">Sentence(s)</font>: Examples of external forcings include changes in atmospheric composition (e.g., increased concentrations of greenhouse gases), solar luminosity, volcanic eruptions, and variations in Earth's orbit around the Sun."
Periodic_table-Mendeleev's_table,"<font color=""blue"">Question</font>: What characteristic of Mendeleev's periodic table implicitly predicted the properties of elements that had not yet been discovered?<br/><font color=""blue"">Sentence(s)</font>: The first was to leave gaps in the table when it seemed that the corresponding element had not yet been discovered.</br>Mendeleev was not the first chemist to do so, but he was the first to be recognized as using the trends in his periodic table to predict the properties of those missing elements, such as gallium and germanium."
