paragraph_id,content
Physics-Modern_physics,"<font color=""blue"">Question</font>: What was a problem for classical physics?<br/><font color=""blue"">Sentence(s)</font>: Black body radiation provided another problem for classical physics, which was corrected when Planck proposed that light comes in individual packets known as photons; this, along with the photoelectric effect and a complete theory predicting discrete energy levels of electron orbitals, led to the theory of quantum mechanics taking over from classical physics at very small scales.Quantum mechanics would come to be pioneered by Werner Heisenberg, Erwin Schrödinger and Paul Dirac."
Biology-Cell_theory,"<font color=""blue"">Question</font>: What process includes the phonoomenon of energy flow in cells?<br/><font color=""blue"">Sentence(s)</font>: In addition, the phenomenon of energy flow occurs in cells in processes that are part of the function known as metabolism."
Evolution-Mutation,"<font color=""blue"">Question</font>: What are large enzymes that make antibiotics called?<br/><font color=""blue"">Sentence(s)</font>: For example, polyketide synthases are large enzymes that make antibiotics; they contain up to one hundred independent domains that each catalyse one step in the overall process, like a step in an assembly line."
Anatomy-Research_and_practice,"<font color=""blue"">Question</font>: What is primarily the scientific study of the morphology of the adult human body?<br/><font color=""blue"">Sentence(s)</font>: Human anatomy.Research and practice.Human anatomy, including gross human anatomy and histology, is primarily the scientific study of the morphology of the adult human body."
Astrology-Scientific_analysis_and_criticism,"<font color=""blue"">Question</font>: What two forms of confirmation bias are under study with respect to astrological belief?<br/><font color=""blue"">Sentence(s)</font>: From the literature, Astrology believers often tend to selectively remember those predictions which have turned out to be true, and do not remember those predictions which happen to be false.</br>Another, separate, form of confirmation bias also plays a role, where believers often fail to distinguish between messages that demonstrate special ability and those which do not."
Solar_System-Heliopause,"<font color=""blue"">Question</font>: What is the name for the location where the solar wind collides with the interstellar wind?<br/><font color=""blue"">Sentence(s)</font>: The collision occurs at the termination shock, which is roughly 80–100 AU from the Sun upwind of the interstellar medium and roughly 200 AU from the Sun downwind."
NASA-Medicine_in_space,"<font color=""blue"">Question</font>: What is an example of a medical study being conducted in space by the National Space Biomedical Research Institute?<br/><font color=""blue"">Sentence(s)</font>: Prominent among these is the Advanced Diagnostic Ultrasound in Microgravity Study, in which astronauts (including former ISS Commanders Leroy Chiao and Gennady Padalka) perform ultrasound scans under the guidance of remote experts to diagnose and potentially treat hundreds of medical conditions in space."
RNA-Regulatory_RNAs,"<font color=""blue"">Question</font>: What is one way antisense RNA can act as a binding to an mRNA?<br/><font color=""blue"">Sentence(s)</font>: One way antisense RNA can act is by binding to an mRNA, forming double-stranded RNA that is enzymatically degraded."
Virus-Host_range,"<font color=""blue"">Question</font>: What are by far the most abundant biological entities on Earth and outnumber all the others put together?<br/><font color=""blue"">Sentence(s)</font>: Viruses are by far the most abundant biological entities on Earth and they outnumber all the others put together."
Bacteria-Bacteriophages,"<font color=""blue"">Question</font>: What are bacteriophages?<br/><font color=""blue"">Sentence(s)</font>: Bacteriophages are viruses that infect bacteria."
Yeast-Nonalcoholic_beverages,"<font color=""blue"">Question</font>: How are kefir and kumis made?<br/><font color=""blue"">Sentence(s)</font>: ""Kefir"" and ""kumis"" are made by fermenting milk with yeast and bacteria."
Microscope-Electron_microscopy,"<font color=""blue"">Question</font>: Who started development of the first electron microscope in 1931 which was the transmission electron microscope (TEM)?<br/><font color=""blue"">Sentence(s)</font>: Ernst Ruska started development of the first electron microscope in 1931 which was the transmission electron microscope (TEM)."
Telescope-History,"<font color=""blue"">Question</font>: What is the maximum physical size limit for refracting telescopes?<br/><font color=""blue"">Sentence(s)</font>: The maximum physical size limit for refracting telescopes is about 1 meter (40 inches), dictating that the vast majority of large optical researching telescopes built since the turn of the 20th century have been reflectors."
Black_hole-Entropy_and_thermodynamics,"<font color=""blue"">Question</font>: What did Bekenstein propose about black holes?<br/><font color=""blue"">Sentence(s)</font>: Therefore, Bekenstein proposed that a black hole should have an entropy, and that it should be proportional to its horizon area.The link with the laws of thermodynamics was further strengthened by Hawking's discovery that quantum field theory predicts that a black hole radiates blackbody radiation at a constant temperature."
Nebula-Diffuse_nebulae,"<font color=""blue"">Question</font>: What is diffuse nebulae?<br/><font color=""blue"">Sentence(s)</font>: Most nebulae can be described as diffuse nebulae, which means that they are extended and contain no well-defined boundaries."
Aurora-Solar_wind_and_the_magnetosphere,"<font color=""blue"">Question</font>: What is the width of the mangetosphere of the Earth?<br/><font color=""blue"">Sentence(s)</font>: The width of the magnetosphere abreast of Earth, is typically 190,000 km (30 Re), and on the night side a long ""magnetotail"" of stretched field lines extends to great distances (> 200 Re).The magnetosphere is full of trapped plasma as the solar wind passes the Earth."
Taco-Soft-shell_tacos,"<font color=""blue"">Question</font>: What is the traditional definition of a ""soft taco""?<br/><font color=""blue"">Sentence(s)</font>: Traditionally, soft-shelled tacos referred to corn tortillas that were cooked to a softer state than a hard taco - usually by grilling or steaming."
Hamburger-Mexico,"<font color=""blue"">Question</font>: What is a Hawaiian hamburger?<br/><font color=""blue"">Sentence(s)</font>: A slice of pineapple is also a usual option, and the variation is known as a ""Hawaiian hamburger"".Some restaurants' burgers also have barbecue sauce, and others also replace the ground patty with sirloin, Al pastor meat, barbacoa or a fried chicken breast."
French_fries-Tornado_fries,"<font color=""blue"">Question</font>: How are tornado fries made?<br/><font color=""blue"">Sentence(s)</font>: Tornado fries are made by skewering the whole potato, and then cutting with a specialized spiral slicer."
Sausage-Casings,"<font color=""blue"">Question</font>: What was saussage casing originally made from?<br/><font color=""blue"">Sentence(s)</font>: Traditionally, sausage casings were made of the cleaned intestines, or stomachs in the case of haggis and other traditional puddings."
Bacon-Bacon_mania,"<font color=""blue"">Question</font>: What type of online club has Bobby Flay endorsed?<br/><font color=""blue"">Sentence(s)</font>: Restaurants have organized and are organizing bacon and beer tasting nights, ""The New York Times"" reported on bacon infused with Irish whiskey used for Saint Patrick's Day cocktails, and celebrity chef Bobby Flay has endorsed a ""Bacon of the Month"" club online, in print, and on national television.Commentators explain this surging interest in bacon by reference to what they deem American cultural characteristics."
Kebab-In_China,"<font color=""blue"">Question</font>: What meats are traditionally used to make Chuanr?<br/><font color=""blue"">Sentence(s)</font>: The dish has since spread across the rest of the country and become a popular street food.Although the most traditional form of chuanr uses lamb or mutton, other types of meat, such as chicken, beef, pork, and seafood, may be used as well."
Ramen-Noodles,"<font color=""blue"">Question</font>: What was ""kansui"" named after?<br/><font color=""blue"">Sentence(s)</font>: Originally, ""kansui"" was named after the water from Inner Mongolia's Lake Kan which contained large amounts of these minerals and was said to be perfect for making these noodles."
Udon-Cold,"<font color=""blue"">Question</font>: What does Hadaka udon refer to?<br/><font color=""blue"">Sentence(s)</font>:  ""Hadaka udon"" (naked udon 裸うどん): Cold udon served on its own."
Rice-Europe,"<font color=""blue"">Question</font>: Where was rice imported from to the Classical world?<br/><font color=""blue"">Sentence(s)</font>: Rice was known to the Classical world, being imported from Egypt, and perhaps west Asia."
Steak-Abstract,"<font color=""blue"">Question</font>: How do you generally cook a fish steak?<br/><font color=""blue"">Sentence(s)</font>: Meat steaks are usually grilled, pan-fried, or broiled, while fish steaks may also be baked.Steak can also be meat cooked in sauce, such as steak and kidney pie, or minced meat formed into a steak shape, such as Salisbury steak and hamburger steak."
Salad-Abstract,"<font color=""blue"">Question</font>: What distinguishes a Main course salad from an Appetizer salad?<br/><font color=""blue"">Sentence(s)</font>: Appetizer salads, light salads to stimulate the appetite as the first course of the meal.</br>Main course salads, usually containing a portion of heartier fare, such as chicken breast or slices of beef."
Popcorn-Consumption,"<font color=""blue"">Question</font>: How is popcorn often served in Peru?<br/><font color=""blue"">Sentence(s)</font>: In Peru, popcorn is sometimes sweetened with small candy pellets and sweetened condensed milk, but its more often eaten with salt and the only buttered version known to any considerable degree is microwave popcorn."
Cake-History,"<font color=""blue"">Question</font>: Where does the word ""cake"" come from?<br/><font color=""blue"">Sentence(s)</font>: The word itself is of Viking origin, from the Old Norse word ""kaka"".Although clear examples of the difference between cake and bread are easy to find, the precise classification has always been elusive."
Ice_cream-Cryogenic,"<font color=""blue"">Question</font>: What is used to freeze and harden ice cream?<br/><font color=""blue"">Sentence(s)</font>: Using liquid nitrogen to freeze ice cream is an old idea and has been used for many years to harden ice cream."
Yogurt-Non-dairy_yogurt_substitutes,"<font color=""blue"">Question</font>: Is it possible to produce genuine yogurt from plant sources?<br/><font color=""blue"">Sentence(s)</font>: sauerkraut), since plants do not produce lactose, it is not possible to produce genuine yogurt from plant sources with the same bacteria cultures used to convert milk into yogurt."
Cheese-Origins,"<font color=""blue"">Question</font>: What do animals skins and organs do?<br/><font color=""blue"">Sentence(s)</font>: Since animal skins and inflated internal organs have, since ancient times, provided storage vessels for a range of foodstuffs, it is probable that the process of cheese making was discovered accidentally by storing milk in a container made from the stomach of an animal, resulting in the milk being turned to curd and whey by the rennet from the stomach."
Coffee-Ecological_effects,"<font color=""blue"">Question</font>: What is the sun cultivation method?<br/><font color=""blue"">Sentence(s)</font>: Starting in the 1970s, many farmers switched their production method to sun cultivation, in which coffee is grown in rows under full sun with little or no forest canopy."
Juice-Abstract,"<font color=""blue"">Question</font>: What is juice?<br/><font color=""blue"">Sentence(s)</font>: Juice is a liquid that is naturally contained in fruit and vegetables."